{
  "schema_version": "map_component_media_manifest.v0.2",
  "media_pack_id": "map_component_media_pack_v0_2_preview",
  "created_at": "2026-07-05T00:00:00Z",
  "source_manifest_path": "game_data/media/map_components/map_component_media_manifest.v0.1.json",
  "source_manifest_schema_version": "map_component_media_manifest.v0.1",
  "source_style_pack_paths": [
    "examples/map_style_packs/long_night_lamp_wick_store.map_style_pack.json",
    "examples/map_style_packs/long_night_old_signal_tower.map_style_pack.json",
    "examples/map_style_packs/long_night_ruined_outpost.map_style_pack.json"
  ],
  "public_url_prefix": "/assets/map_components",
  "media_layer": "reviewed_map_component_media_preview_v0_2",
  "usage_policy": [
    "review_gate_only",
    "not_runtime_semantic_source",
    "no_image_to_map_semantic_inference",
    "local_reviewed_component_only",
    "no_frontend_default_consumption",
    "no_provider_or_prompt_payload",
    "no_external_temporary_url",
    "preview_artifact_only"
  ],
  "items": [
    {
      "stable_internal_id": "map_component_lamp_wick_store_terrain_wick_store_oiled_stone",
      "asset_id": "map_component_lamp_wick_store_terrain_wick_store_oiled_stone",
      "asset_type": "map_component",
      "media_role": "map_component_material",
      "media_layer": "reviewed_map_component_media_preview_v0_2",
      "media_kind": "svg",
      "component_role": "terrain_base",
      "style_pack_id": "style_long_night_lamp_wick_store_v0_1",
      "node_id": "lamp_wick_store",
      "source_owner_id": "terrain_wick_store_oiled_stone",
      "source_binding": "material.component_ref",
      "url": "/assets/map_components/processed/map_component_lamp_wick_store_terrain_wick_store_oiled_stone.svg",
      "local_path": "game_data/media/map_components/processed/map_component_lamp_wick_store_terrain_wick_store_oiled_stone.svg",
      "width": 256,
      "height": 256,
      "sha256": "0f74d75c225607cc3984160e3f0ddf6a71a7f803e69f66d95f3c54b202fdf080",
      "file_type": "svg",
      "usage_policy": [
        "review_gate_only",
        "not_runtime_semantic_source",
        "no_image_to_map_semantic_inference",
        "local_reviewed_component_only",
        "no_frontend_default_consumption",
        "no_provider_or_prompt_payload",
        "no_external_temporary_url",
        "preview_artifact_only"
      ],
      "source_kind": "deterministic_developer_fixture_svg"
    },
    {
      "stable_internal_id": "map_component_lamp_wick_store_terrain_wick_store_ash_crate_detail",
      "asset_id": "map_component_lamp_wick_store_terrain_wick_store_ash_crate_detail",
      "asset_type": "map_component",
      "media_role": "map_component_material",
      "media_layer": "reviewed_map_component_media_preview_v0_2",
      "media_kind": "svg",
      "component_role": "terrain_detail",
      "style_pack_id": "style_long_night_lamp_wick_store_v0_1",
      "node_id": "lamp_wick_store",
      "source_owner_id": "terrain_wick_store_ash_crate_detail",
      "source_binding": "material.component_ref",
      "url": "/assets/map_components/processed/map_component_lamp_wick_store_terrain_wick_store_ash_crate_detail.svg",
      "local_path": "game_data/media/map_components/processed/map_component_lamp_wick_store_terrain_wick_store_ash_crate_detail.svg",
      "width": 256,
      "height": 256,
      "sha256": "b2f0b8753d487419da9f5ff9fb11648d822774ced7e2732bd0a8f5a27cd70003",
      "file_type": "svg",
      "usage_policy": [
        "review_gate_only",
        "not_runtime_semantic_source",
        "no_image_to_map_semantic_inference",
        "local_reviewed_component_only",
        "no_frontend_default_consumption",
        "no_provider_or_prompt_payload",
        "no_external_temporary_url",
        "preview_artifact_only"
      ],
      "source_kind": "deterministic_developer_fixture_svg"
    },
    {
      "stable_internal_id": "map_component_lamp_wick_store_road_wick_store_old_pipe_track",
      "asset_id": "map_component_lamp_wick_store_road_wick_store_old_pipe_track",
      "asset_type": "map_component",
      "media_role": "map_component_material",
      "media_layer": "reviewed_map_component_media_preview_v0_2",
      "media_kind": "svg",
      "component_role": "road_band",
      "style_pack_id": "style_long_night_lamp_wick_store_v0_1",
      "node_id": "lamp_wick_store",
      "source_owner_id": "road_wick_store_old_pipe_track",
      "source_binding": "material.component_ref",
      "url": "/assets/map_components/processed/map_component_lamp_wick_store_road_wick_store_old_pipe_track.svg",
      "local_path": "game_data/media/map_components/processed/map_component_lamp_wick_store_road_wick_store_old_pipe_track.svg",
      "width": 256,
      "height": 256,
      "sha256": "e099e6a208f2d871c76000a475f8882aee165b1c5b6e6fb7d2f0760233b00f2e",
      "file_type": "svg",
      "usage_policy": [
        "review_gate_only",
        "not_runtime_semantic_source",
        "no_image_to_map_semantic_inference",
        "local_reviewed_component_only",
        "no_frontend_default_consumption",
        "no_provider_or_prompt_payload",
        "no_external_temporary_url",
        "preview_artifact_only"
      ],
      "source_kind": "deterministic_developer_fixture_svg"
    },
    {
      "stable_internal_id": "map_component_lamp_wick_store_road_edge_wick_chalk_and_oil",
      "asset_id": "map_component_lamp_wick_store_road_edge_wick_chalk_and_oil",
      "asset_type": "map_component",
      "media_role": "map_component_material",
      "media_layer": "reviewed_map_component_media_preview_v0_2",
      "media_kind": "svg",
      "component_role": "road_edge",
      "style_pack_id": "style_long_night_lamp_wick_store_v0_1",
      "node_id": "lamp_wick_store",
      "source_owner_id": "road_edge_wick_chalk_and_oil",
      "source_binding": "material.component_ref",
      "url": "/assets/map_components/processed/map_component_lamp_wick_store_road_edge_wick_chalk_and_oil.svg",
      "local_path": "game_data/media/map_components/processed/map_component_lamp_wick_store_road_edge_wick_chalk_and_oil.svg",
      "width": 256,
      "height": 256,
      "sha256": "8f87e12d330fe01082c8ab74b30c6fc9a3e5a0512f1ac9e5af700219f13fcc1f",
      "file_type": "svg",
      "usage_policy": [
        "review_gate_only",
        "not_runtime_semantic_source",
        "no_image_to_map_semantic_inference",
        "local_reviewed_component_only",
        "no_frontend_default_consumption",
        "no_provider_or_prompt_payload",
        "no_external_temporary_url",
        "preview_artifact_only"
      ],
      "source_kind": "deterministic_developer_fixture_svg"
    },
    {
      "stable_internal_id": "map_component_lamp_wick_store_platform_wick_store_brass_floor_ring",
      "asset_id": "map_component_lamp_wick_store_platform_wick_store_brass_floor_ring",
      "asset_type": "map_component",
      "media_role": "map_component_prefab",
      "media_layer": "reviewed_map_component_media_preview_v0_2",
      "media_kind": "svg",
      "component_role": "build_slot_platform",
      "style_pack_id": "style_long_night_lamp_wick_store_v0_1",
      "node_id": "lamp_wick_store",
      "source_owner_id": "platform_wick_store_brass_floor_ring",
      "source_binding": "prefab.visual_ref",
      "url": "/assets/map_components/processed/map_component_lamp_wick_store_platform_wick_store_brass_floor_ring.svg",
      "local_path": "game_data/media/map_components/processed/map_component_lamp_wick_store_platform_wick_store_brass_floor_ring.svg",
      "width": 256,
      "height": 256,
      "sha256": "06a507a2d65df8bf726f0234fdb9d7a759f36f08266bdda65382b3d1f41e5e7b",
      "file_type": "svg",
      "usage_policy": [
        "review_gate_only",
        "not_runtime_semantic_source",
        "no_image_to_map_semantic_inference",
        "local_reviewed_component_only",
        "no_frontend_default_consumption",
        "no_provider_or_prompt_payload",
        "no_external_temporary_url",
        "preview_artifact_only"
      ],
      "source_kind": "deterministic_developer_fixture_svg"
    },
    {
      "stable_internal_id": "map_component_lamp_wick_store_objective_wick_store_shelf_foundation",
      "asset_id": "map_component_lamp_wick_store_objective_wick_store_shelf_foundation",
      "asset_type": "map_component",
      "media_role": "map_component_prefab",
      "media_layer": "reviewed_map_component_media_preview_v0_2",
      "media_kind": "svg",
      "component_role": "objective_foundation",
      "style_pack_id": "style_long_night_lamp_wick_store_v0_1",
      "node_id": "lamp_wick_store",
      "source_owner_id": "objective_wick_store_shelf_foundation",
      "source_binding": "prefab.visual_ref",
      "url": "/assets/map_components/processed/map_component_lamp_wick_store_objective_wick_store_shelf_foundation.svg",
      "local_path": "game_data/media/map_components/processed/map_component_lamp_wick_store_objective_wick_store_shelf_foundation.svg",
      "width": 256,
      "height": 256,
      "sha256": "910149a68c7553b207de9be5559f60252b9100b752348b605f93daa804199ddc",
      "file_type": "svg",
      "usage_policy": [
        "review_gate_only",
        "not_runtime_semantic_source",
        "no_image_to_map_semantic_inference",
        "local_reviewed_component_only",
        "no_frontend_default_consumption",
        "no_provider_or_prompt_payload",
        "no_external_temporary_url",
        "preview_artifact_only"
      ],
      "source_kind": "deterministic_developer_fixture_svg"
    },
    {
      "stable_internal_id": "map_component_lamp_wick_store_spawn_pipe_shadow_leak",
      "asset_id": "map_component_lamp_wick_store_spawn_pipe_shadow_leak",
      "asset_type": "map_component",
      "media_role": "map_component_prefab",
      "media_layer": "reviewed_map_component_media_preview_v0_2",
      "media_kind": "svg",
      "component_role": "spawn_marker",
      "style_pack_id": "style_long_night_lamp_wick_store_v0_1",